{
  "id": "official/problem-solving-debug",
  "name": "problem-solving-debug",
  "display_name": "问题排查与调试",
  "description": "系统性问题排查与根因分析。当遇到之前可以做到但后来有问题、反复失败、需要找到根本原因时触发。",
  "version": "1.0.0",
  "icon": "🐛",
  "category": "code_debug",
  "runtime_type": "local",
  "owner": { "name": "official", "type": "official", "verified": true, "avatar": "🏢", "url": "" },
  "readme": "SKILL.md",
  "files": [],
  "env_vars": [],
  "dependencies": [],
  "platform": { "host": "openclaw", "min_version": "1.0", "capabilities": ["local-execution"] },
  "changelog": [
    { "version": "1.0.0", "date": "2026-01-01", "changes": ["初始版本"], "type": "MINOR" }
  ],
  "created_at": "2026-01-01T00:00:00Z",
  "updated_at": "2026-01-01T00:00:00Z"
}
