{
  "id": "official/md-to-pdf",
  "name": "md-to-pdf",
  "display_name": "Markdown 转 PDF",
  "description": "将 Markdown 文档转换为 PDF。当用户请求把 md 转 pdf、导出 pdf、批量转换时触发。",
  "description_en": "Convert Markdown documents to PDF. Use when user requests MD to PDF conversion or batch conversion.",
  "version": "1.0.0",
  "icon": "📄",
  "category": "document",
  "runtime_type": "local",
  "owner": {
    "name": "official",
    "type": "official",
    "verified": true,
    "avatar": "🏢",
    "url": ""
  },
  "readme": "SKILL.md",
  "files": [],
  "env_vars": [],
  "dependencies": [
    { "name": "pandoc", "min_version": "2.0", "type": "tool" },
    { "name": "wkhtmltopdf", "min_version": "0.12", "type": "tool" },
    { "name": "python", "min_version": "3.10", "type": "runtime" }
  ],
  "platform": {
    "host": "openclaw",
    "min_version": "1.0",
    "capabilities": ["local-execution"]
  },
  "hot": false,
  "examples": ["/examples/md-to-pdf-sample.pdf"],
  "changelog": [
    {
      "version": "1.0.0",
      "date": "2026-01-01",
      "changes": ["初始版本，pandoc + wkhtmltopdf 转换流程"],
      "type": "MINOR"
    }
  ],
  "created_at": "2026-01-01T00:00:00Z",
  "updated_at": "2026-01-01T00:00:00Z"
}
