{
  "id": "official/minimax-docx",
  "name": "minimax-docx",
  "display_name": "Word 文档生成",
  "description": "创建、编辑、排版 Word 文档。当用户请求生成 docx、写报告、起草合同、填充表单时触发。",
  "version": "1.0.0",
  "icon": "📝",
  "category": "document",
  "runtime_type": "local",
  "owner": { "name": "official", "type": "official", "verified": true, "avatar": "🏢", "url": "" },
  "readme": "SKILL.md",
  "files": [],
  "env_vars": [],
  "dependencies": [
    { "name": "dotnet", "min_version": "8.0", "type": "runtime" },
    { "name": "openxml-sdk", "min_version": "3.0", "type": "tool" }
  ],
  "platform": { "host": "openclaw", "min_version": "1.0", "capabilities": ["local-execution"] },
  "changelog": [
    { "version": "1.0.0", "date": "2026-01-01", "changes": ["初始版本"], "type": "MINOR" }
  ],
  "created_at": "2026-01-01T00:00:00Z",
  "updated_at": "2026-01-01T00:00:00Z"
}
