{
  "id": "official/skill-expansion",
  "name": "skill-expansion",
  "display_name": "技能扩充",
  "description": "技能扩充规则与来源优先级。当需要扩充技能、定义技能来源优先级时触发。",
  "version": "1.0.0",
  "icon": "➕",
  "category": "code_debug",
  "runtime_type": "local",
  "owner": { "name": "official", "type": "official", "verified": true, "avatar": "🏢", "url": "" },
  "readme": "SKILL.md",
  "files": [],
  "env_vars": [],
  "dependencies": [],
  "platform": { "host": "openclaw", "min_version": "1.0", "capabilities": ["local-execution"] },
  "changelog": [
    { "version": "1.0.0", "date": "2026-01-01", "changes": ["初始版本"], "type": "MINOR" }
  ],
  "created_at": "2026-01-01T00:00:00Z",
  "updated_at": "2026-01-01T00:00:00Z"
}
