{
  "id": "official/self-improving-agent",
  "name": "self-improving-agent",
  "display_name": "自改进 Agent",
  "description": "记录学习错误并持续自改进。当需要记录错误、修正行为、持续改进 Agent 能力时触发。",
  "version": "1.0.0",
  "icon": "🔄",
  "category": "code_debug",
  "runtime_type": "local",
  "owner": { "name": "official", "type": "official", "verified": true, "avatar": "🏢", "url": "" },
  "readme": "SKILL.md",
  "files": [],
  "env_vars": [],
  "dependencies": [],
  "platform": { "host": "openclaw", "min_version": "1.0", "capabilities": ["local-execution"] },
  "changelog": [
    { "version": "1.0.0", "date": "2026-01-01", "changes": ["初始版本"], "type": "MINOR" }
  ],
  "created_at": "2026-01-01T00:00:00Z",
  "updated_at": "2026-01-01T00:00:00Z"
}
