{
  "id": "official/vision-ocr",
  "name": "vision-ocr",
  "display_name": "视觉 OCR 识别",
  "description": "视觉大模型图片 OCR 文字识别。当用户请求图片文字识别、OCR、提取图片文本时触发。",
  "version": "1.0.0",
  "icon": "👁️",
  "category": "code_debug",
  "runtime_type": "external_api",
  "owner": { "name": "official", "type": "official", "verified": true, "avatar": "🏢", "url": "" },
  "readme": "SKILL.md",
  "files": [],
  "env_vars": [
    { "key": "API_KEY", "description": "视觉模型 API key（OpenClaw 自动获取）", "required": false, "source": "OpenClaw 平台配置", "example": "自动获取" }
  ],
  "api": {
    "base_url": "ospreyai 视觉模型端点",
    "auth_type": "gateway",
    "endpoints": [
      { "method": "POST", "path": "<视觉模型端点>", "desc": "调用视觉 LLM 识别图片（默认模型 qwen3-vl-30b）" }
    ],
    "rate_limit": "10/min/IP burst 5",
    "timeout_sec": 60
  },
  "platform": { "host": "openclaw", "min_version": "1.0", "capabilities": ["vision-model", "skill-install"] },
  "changelog": [
    { "version": "1.0.0", "date": "2026-01-01", "changes": ["初始版本"], "type": "MINOR" }
  ],
  "created_at": "2026-01-01T00:00:00Z",
  "updated_at": "2026-01-01T00:00:00Z"
}
