{
  "id": "official/openclaw-wecom-channel",
  "name": "openclaw-wecom-channel",
  "display_name": "企业微信渠道接入",
  "description": "将企业微信机器人接入 OpenClaw。当用户请求企业微信渠道接入、配置 Bot ID/Secret、验证连通时触发。",
  "version": "1.0.0",
  "icon": "🏢",
  "category": "mail_communication",
  "runtime_type": "local",
  "owner": { "name": "official", "type": "official", "verified": true, "avatar": "🏢", "url": "" },
  "readme": "SKILL.md",
  "files": [],
  "env_vars": [
    { "key": "WECOM_BOT_ID", "description": "企业微信机器人 Bot ID", "required": true, "source": "企业微信管理后台", "example": "wecom-xxx" },
    { "key": "WECOM_BOT_SECRET", "description": "企业微信机器人 Secret", "required": true, "source": "企业微信管理后台", "example": "secret 占位" }
  ],
  "dependencies": [],
  "platform": { "host": "openclaw", "min_version": "1.0", "capabilities": ["channel-wecom"] },
  "changelog": [
    { "version": "1.0.0", "date": "2026-01-01", "changes": ["初始版本"], "type": "MINOR" }
  ],
  "created_at": "2026-01-01T00:00:00Z",
  "updated_at": "2026-01-01T00:00:00Z"
}
